{
  "schema_version": "0.1.0",
  "program": {
    "id": "global-aiesec-global-talent",
    "name": "AIESEC 全球人才计划（企业实习）",
    "name_en": "AIESEC Global Talent",
    "country": "全球（120+ 国家和地区）",
    "country_code": "GL",
    "region": "global",
    "program_type": "paid_internship",
    "visa_code": "各国实习/工作签证（由 AIESEC 驻在国分会协助）",
    "official_url": "https://aiesec.org/global-talent",
    "authority": "AIESEC 国际总会及各国分会",
    "summary": "AIESEC 的海外企业实习平台，由全球企业合作伙伴发布实习岗位，覆盖商科、技术、市场、工程、金融等领域。实习时长 3-18 个月，可能提供薪资或住宿支持。AIESEC 提供文化准备、签证支持与强制保险。",
    "tags": [
      "stem_friendly",
      "requires_agency",
      "no_quota_cap",
      "rolling"
    ],
    "active": true
  },

  "eligibility": {
    "passport_types": {
      "mainland_china": "eligible",
      "hong_kong_china": "eligible",
      "taiwan_china": "eligible",
      "note": "不限护照类型。但具体岗位的资格取决于各国雇主自设的要求（专业、语言、经验）。"
    },
    "age": {
      "min": 0,
      "max": 99,
      "note": "⚠️ 未核实。官方页 aiesec.org/global-talent（2026-10-30 复核）全文未出现任何年龄限制表述（`18` 命中 0 次），因此不再保留「18-30 岁」这一无官方依据的二手数字。原数值来自第三方概述页 Opportunity Nest。报名前须向 AIESEC 中国分会确认。"
    },
    "education": {
      "minimum_level": "any",
      "major_restriction": [],
      "note": "⚠️ 未核实。官方页未公布任何学历门槛，因此不再保留「硕士在读或本科毕业 2 个月内」这一二手说法（原来源为 Opportunity Nest）。官方页只说明岗位按领域分类（商管、IT、市场、工程、金融等），具体资格由各岗位自行设定。"
    },
    "language": {
      "required": false,
      "tests": [],
      "note": "⚠️ 未核实。官方页未提及语言要求；实际门槛由各岗位雇主设定，不以考试分数为门槛。"
    },
    "funds": {
      "required": false,
      "note": "无官方资金门槛。需自行承担出行成本。"
    },
    "other_requirements": [
      {
        "type": "enrollment_proof",
        "required": false,
        "note": "⚠️ 官方页未提及在读/毕业时间要求；「硕士在读需保持学籍、本科毕业 2 个月内」来自第三方概述页，未能核实。"
      },
      {
        "type": "insurance",
        "required": false,
        "note": "⚠️ 官方页未提及强制保险；「AIESEC 强制购买」来自第三方概述页，未能核实。"
      },
      {
        "type": "internship_contract",
        "required": true,
        "note": "由 AIESEC 合作企业发布岗位并提供"
      }
    ]
  },

  "timeline": {
    "mechanism": "rolling",
    "quota": null,
    "quota_note": "无统一名额上限。岗位由企业合作伙伴滚动发布，无固定申请周期。",
    "windows": [
      {
        "year": 2026,
        "status": "open",
        "note": "全年滚动申请，无固定截止日期。热门岗位或地区可能因申请量足够而提前关闭。每年 2-3 月是各国分会发放录取的高峰期。"
      }
    ],
    "fees": [],
    "processing_time": "⚠️ 官方页未公布审理时长（未能核实）。"
  },

  "documents": [
    { "name": "AIESEC 平台档案", "required": true, "note": "含技能、背景、经历、语言、简历（类似 LinkedIn）", "prepare_days": 7 },
    { "name": "简历（CV）", "required": true, "note": "", "prepare_days": 14 },
    { "name": "在读证明或毕业证明", "required": true, "note": "证明当前在读或毕业 2 个月内", "prepare_days": 14 },
    { "name": "有效护照", "required": true, "note": "用于后续签证安排", "prepare_days": 30 }
  ],

  "steps": [
    {
      "step_no": 1,
      "title": "在 AIESEC 平台创建档案",
      "description": "注册 AIESEC 账号，完善个人档案（技能、背景、工作经历、教育、语言、简历）。档案完整度直接影响被雇主选中的概率。",
      "duration": "1-2 天",
      "official_link": "https://aiesec.org/global-talent"
    },
    {
      "step_no": 2,
      "title": "按领域与地区搜索并申请岗位",
      "description": "浏览全球企业发布的实习岗位（覆盖商科、技术、市场、工程、金融）。可同时申请多个岗位，无数量限制。",
      "duration": "持续",
      "official_link": "https://aiesec.org/global-talent"
    },
    {
      "step_no": 3,
      "title": "通过雇主的选拔流程",
      "description": "档案匹配后，由 AIESEC 驻在国分会及企业进行面试。部分岗位可能有额外评估环节。",
      "duration": "2-6 周",
      "official_link": "https://aiesec.org/global-talent"
    },
    {
      "step_no": 4,
      "title": "接受 offer 并缴费",
      "description": "收到录取 offer 并接受后，支付约 700 美元项目费。不接受则不付费。",
      "duration": "1 周",
      "official_link": "https://aiesec.org/global-talent"
    },
    {
      "step_no": 5,
      "title": "签证、保险与文化准备",
      "description": "AIESEC 协调签证文件、安排强制保险、提供跨文化准备培训。由驻在国分会协助住宿与落地接机。",
      "duration": "1-3 个月",
      "official_link": "https://aiesec.org/global-talent"
    },
    {
      "step_no": 6,
      "title": "赴外实习",
      "description": "抵达后由驻在国分会安排接机与住宿，开始实习。实习时长视岗位为 3-18 个月。",
      "duration": "3-18 个月",
      "official_link": "https://aiesec.org/global-talent"
    }
  ],

  "work_conditions": {
    "max_stay_months": 18,
    "max_same_employer_months": 18,
    "max_study_months": 0,
    "renewable": false,
    "renewal_condition": "视岗位与签证类型而定。",
    "restricted_occupations": [],
    "note": "补偿形式视岗位而定：可能提供薪资支持或住宿支持。实习通常为带薪（paid）。"
  },

  "risks": [
    {
      "level": "warning",
      "description": "岗位质量差异极大。AIESEC 是平台性质，具体体验完全取决于所申请的企业与岗位，签约前务必核实雇主真实性。"
    },
    {
      "level": "warning",
      "description": "本科毕业生须在毕业 2 个月内申请。超出时间窗口即失去资格。硕士在读须确保实习全程保持学籍。"
    },
    {
      "level": "warning",
      "description": "部分 AIESEC 岗位为**志愿者项目**（Global Volunteer，非带薪），与 Global Talent（实习）不同。申请时务必区分，避免误报。"
    },
    {
      "level": "info",
      "description": "优势：覆盖 120+ 国家、岗位领域广、企业实习平台化、有签证与保险支持。相比独立申请海外实习，降低了信息与流程门槛。"
    }
  ],

  "sources": [
    {
      "type": "primary",
      "name": "AIESEC Global Talent（官方项目页）",
      "url": "https://aiesec.org/global-talent",
      "publisher": "AIESEC International",
      "last_verified": "2026-10-30",
      "verified_by": "eddieye1004",
      "claim": "Global Talent 平台定位、岗位领域划分与在招数量（67 个国家/地区、2,000+ 实习岗位）、4 步申请流程、提供签证与落地支持。该页**未**公布年龄、学历、费用、保险要求。"
    },
    {
      "type": "secondary",
      "name": "AIESEC Global Talent 2026 概述",
      "url": "https://www.opportunitynest.org/opportunity/aiesec-global-talent-global",
      "publisher": "Opportunity Nest",
      "last_verified": "2026-10-30",
      "verified_by": "eddieye1004",
      "claim": "二手概述（2026-10-30 复核原文）：年龄 mainly people between 18 and 30（原文用 mainly，非硬性区间）；学籍条件为「我们查过的德国岗位」的个例——accepted only master's students who stay enrolled for the whole internship, or bachelor's graduates within two months of graduating，**不是全球统一门槛**；Life and health insurance is mandatory；There is no single deadline, internships are posted and filled continuously。该页同时写明 AIESEC's central pages do not mention a programme fee，即连这篇二手来源也未给费用数字，故数据里 700 USD 项目费无法追溯来源、已删除。"
    }
  ],

  "last_verified": "2026-10-30",
  "verified_by": "eddieye1004"
}
