{
  "schema_version": "0.1.0",
  "program": {
    "id": "ca-iec-working-holiday",
    "name": "加拿大国际经验计划（IEC 打工度假）",
    "name_en": "International Experience Canada (IEC) — Working Holiday",
    "country": "加拿大",
    "country_code": "CA",
    "region": "north_america",
    "program_type": "working_holiday",
    "visa_code": "IEC-WH",
    "official_url": "https://www.canada.ca/en/immigration-refugees-citizenship/services/work-canada/iec.html",
    "authority": "Immigration, Refugees and Citizenship Canada（加拿大移民、难民及公民部）",
    "summary": "加拿大与 30 多个国家和地区签订的青年流动协议，允许 18-35 岁青年在加工作，单次停留最长 12 个月（中国香港、中国台湾均为 12 个月，部分签约国可达 24 个月）。⚠️ 中国大陆不在协议名单内，中国大陆护照持有人无法申请此项目。中文互联网上大量'加拿大打工度假'信息实为雇主担保工签，与 IEC 性质完全不同。",
    "tags": [
      "no_agency_needed",
      "high_wage"
    ],
    "active": true
  },

  "eligibility": {
    "passport_types": {
      "mainland_china": "not_eligible",
      "hong_kong_china": "eligible",
      "taiwan_china": "eligible",
      "note": "⚠️ 关键信息：加拿大 IEC 通过双边青年流动协议运作，中国香港与中国台湾在协议名单内，但中国大陆不在。中国大陆护照持有人无法申请 Working Holiday 类别。网上流传的'中国大陆可申请加拿大打工度假'是错误信息。"
    },
    "age": {
      "min": 18,
      "max": 35,
      "note": "18-35 周岁（官方总述 \"18 to 35 (18 to 30 in some countries)\"）。中国香港为 18-30，中国台湾为 18-35，其余签约国多为 18-35"
    },
    "education": {
      "minimum_level": "any",
      "major_restriction": [],
      "note": "无学历硬性要求（依各签约地区协议而定）"
    },
    "language": {
      "required": false,
      "tests": [],
      "note": "官方三个主源页面（iec.html、eligibility.html、eligibility-by-country.html）均未列语言考试要求（IELTS / language test 命中 0）。原记录 IELTS 24 个月无官方依据已移除；是否另有语言要求未能核实。"
    },
    "funds": {
      "required": true,
      "amount": {
        "local_amount": 2500,
        "currency": "CAD",
        "cny_estimate": 13000,
        "note": "约 2,500 加元资金证明"
      },
      "note": "具体金额依签约地区协议而定"
    },
    "other_requirements": [
      {
        "type": "insurance",
        "required": true,
        "note": "官方要求在整个停留期间持有医疗保险（have health insurance for the duration of your stay）"
      }
    ]
  },

  "timeline": {
    "mechanism": "ballot",
    "quota": null,
    "quota_note": "中国大陆不在协议内，无配额。官方主源未公布中国香港、中国台湾的年度配额数字（未能核实）。",
    "windows": [
      {
        "year": 2026,
        "status": "closed",
        "note": "官方原文：2026 IEC season is closed / The pools for the 2026 season are closed. 已获 ITA 者仍可提交工签申请；未获 ITA 者档案被移出池，官方称可在 2027 赛季重新开放时创建新档案。中国大陆无法申请，无相关窗口。"
      }
    ],
    "fees": [
      {
        "item": "开放式工签申请费",
        "amount": { "local_amount": 184.75, "currency": "CAD", "cny_estimate": 960, "note": "官方原文 Processing fees CAN $184.75；官方注「Additional fees may apply.」，生物识别等其他费用另计、未含在内" },
        "refundable": false
      }
    ],
    "processing_time": "约 6 周（官方：Current processing time 6 weeks after you submit all documents and give biometrics）"
  },

  "documents": [
    { "name": "有效护照", "required": true, "note": "须为签约国家/地区签发的护照", "prepare_days": 30 },
    { "name": "资金证明", "required": true, "note": "约 2,500 加元", "prepare_days": 14 },
    { "name": "医疗保险", "required": true, "note": "覆盖全程", "prepare_days": 14 }
  ],

  "steps": [
    {
      "step_no": 1,
      "title": "确认护照资格（第一步，也可能是终点）",
      "description": "加拿大 IEC 仅对签约国家/地区护照开放。中国大陆护照不在名单内。若持中国大陆护照，此项目不可申请，无需继续后续步骤。",
      "duration": "5 分钟",
      "official_link": "https://www.canada.ca/en/immigration-refugees-citizenship/services/work-canada/iec/eligibility.html"
    },
    {
      "step_no": 2,
      "title": "创建 IRCC 账号并进入候选人池",
      "description": "（仅限合格护照持有人）在 IRCC 官网创建账号，提交候选人档案进入抽签池。",
      "duration": "1-2 小时",
      "official_link": "https://www.canada.ca/en/immigration-refugees-citizenship/services/work-canada/iec.html"
    },
    {
      "step_no": 3,
      "title": "等待邀请（ITA）",
      "description": "（仅限合格护照持有人）被抽中后收到申请邀请（Invitation to Apply），在规定期限内提交完整申请。",
      "duration": "不定",
      "official_link": "https://www.canada.ca/en/immigration-refugees-citizenship/services/work-canada/iec.html"
    }
  ],

  "work_conditions": {
    "max_stay_months": 12,
    "max_same_employer_months": 0,
    "renewable": false,
    "renewal_condition": "不可续签。中国香港护照持有人「may participate in IEC only once」、中国台湾护照持有人「only once」，两类合格护照均只能参加一次。",
    "restricted_occupations": [],
    "note": "开放式工签，可为任意雇主工作，无需雇主担保。停留期 12 个月为中国香港、中国台湾两类合格护照的官方上限（up to 12 months），其他签约国可达 24 个月。官方三页未提及学习时长上限（study 仅见 TEER 学历语境），原 max_study_months=6 无依据已删除（未能核实）。"
  },

  "risks": [
    {
      "level": "critical",
      "description": "⚠️ 中国大陆护照不可申请。这是一个显式排除记录，用于纠正中文互联网上广泛流传的错误信息。"
    },
    {
      "level": "critical",
      "description": "大量中介把'加拿大雇主担保工签'包装成'加拿大打工度假'进行推广。两者性质完全不同：IEC 是开放式工签（无需雇主），雇主担保工签需雇主配合且门槛高得多。"
    },
    {
      "level": "info",
      "description": "本记录的存在价值：帮助中国大陆学生快速排除一个不可行的选项，避免浪费时间和金钱。"
    },
    {
      "level": "info",
      "description": "无犯罪记录证明、体检、语言考试三项已从资格条件中移除：官方三个主源页面检索 criminal / police / medical exam / IELTS 命中均为 0，同类表述只有「not be inadmissible to Canada」这一准入性条件。移除依据是反向证据，不等于官方明示无需提供，个案审理仍可能要求（未能核实）。"
    }
  ],

  "sources": [
    {
      "type": "primary",
      "name": "International Experience Canada",
      "url": "https://www.canada.ca/en/immigration-refugees-citizenship/services/work-canada/iec.html",
      "publisher": "Immigration, Refugees and Citizenship Canada",
      "last_verified": "2026-10-29",
      "verified_by": "eddieye1004",
      "claim": "IEC 仅对与加拿大签订青年流动协议的国家/地区开放；中国大陆不在协议名单内；2026 IEC season is closed（pools closed）；Processing fees CAN $184.75；Current processing time 6 weeks after you submit all documents and give biometrics"
    },
    {
      "type": "primary",
      "name": "IEC 参与国家/地区名单（Who can apply）",
      "url": "https://www.canada.ca/en/immigration-refugees-citizenship/services/work-canada/iec/eligibility.html",
      "publisher": "Immigration, Refugees and Citizenship Canada",
      "last_verified": "2026-10-29",
      "verified_by": "eddieye1004",
      "claim": "IEC 参与方为与加拿大签订青年流动协议（YMA）的国家/地区；资格条件（护照、年龄 18-35、资金、保险、返程机票、不可带家属）"
    },
    {
      "type": "primary",
      "name": "IEC eligibility by country（各国 Working Holiday 条款与年龄上限）",
      "url": "https://www.canada.ca/en/immigration-refugees-citizenship/services/work-canada/iec/eligibility/eligibility-by-country.html",
      "publisher": "Immigration, Refugees and Citizenship Canada",
      "last_verified": "2026-10-29",
      "verified_by": "eddieye1004",
      "claim": "官方名单含 Hong Kong 与 Taiwan，不含 China（中国大陆）；Hong Kong—Working Holiday 为 up to 12 months / 18-30 岁 / CAN$2,500 / 只能参加一次；Taiwan—Working Holiday 为 up to 12 months / 18-35 岁 / CAN$2,500 / 只能参加一次；全表 36 个条目中 China 命中 0"
    }
  ],

  "last_verified": "2026-10-29",
  "verified_by": "eddieye1004"
}
